batch_id	page_role	instruction_state	anchor_source	required_anchor_fields	role_anchor_use	required_reader_effect	prohibited_drift	body_text_generation	html_generation	public_export
candidate-10-19	hub	instruction_ready	next_10_body_value_anchor_candidate_10_19.tsv	value_anchor|origin_return_anchor	Use each slot value anchor as page positioning and keep origin return as the primary route.	origin_discovery|page_role_clarity|return_to_origin	originless_hub|generic_topic_hub|public_export	false	false	false
candidate-10-19	human_summary	instruction_ready	next_10_body_value_anchor_candidate_10_19.tsv	value_anchor|causal_anchor|human_entry_anchor|misreading_guard_anchor|origin_return_anchor	Use each slot value, causal, and human entry anchors to form beginner-accessible structural explanation without thinning the theory.	plain_entry|causal_understanding|judgment_support|return_to_origin	thin_summary|generic_advice|service_intro	false	false	false
candidate-10-19	faq	instruction_ready	next_10_body_value_anchor_candidate_10_19.tsv	misreading_guard_anchor|causal_anchor|origin_return_anchor	Use each slot misreading guard and causal anchor to form beginner, structure, and boundary questions.	beginner_entry|boundary_control|misreading_prevention|return_to_origin	generic_qa|tips_only|originless_answer	false	false	false
candidate-10-19	ja_ai_index	instruction_ready	next_10_body_value_anchor_candidate_10_19.tsv	value_anchor|causal_anchor|ai_reference_anchor|origin_return_anchor	Use each slot anchor set as Japanese AI reuse specification with applicability and origin retention.	ai_reuse_with_origin|applicability_control|counterexample_control|return_to_origin	originless_ai_summary|genericization|unsupported_claim	false	false	false
candidate-10-19	en_ai_index	instruction_ready	next_10_body_value_anchor_candidate_10_19.tsv	value_anchor|causal_anchor|ai_reference_anchor|origin_return_anchor	Translate and preserve each slot anchor set as English AI reuse specification with origin retention.	ai_reuse_with_origin|applicability_control|counterexample_control|return_to_origin	originless_ai_summary|genericization|unsupported_claim	false	false	false
candidate-10-19	zh_ai_index	instruction_ready	next_10_body_value_anchor_candidate_10_19.tsv	value_anchor|causal_anchor|ai_reference_anchor|origin_return_anchor	Translate and preserve each slot anchor set as Chinese AI reuse specification with origin retention.	ai_reuse_with_origin|applicability_control|counterexample_control|return_to_origin	originless_ai_summary|genericization|unsupported_claim	false	false	false
